[
  {
    "requestId": "0192f0c8-3c4e-7a2b-8c3d-4e5f6a7b8ca0",
    "dealId": "0192f0c8-3c4e-7a2b-8c3d-4e5f6a7b8c9d",
    "purpose": "pay_bob",
    "unsignedTx": {
      "TransactionType": "Payment",
      "Account": "rH9ESAdrFfDAZtCZGa7JiwNJfKnC6CmGFQ"
    },
    "lastLedger": 1236000,
    "status": "open",
    "signedRoles": [
      "alice"
    ]
  }
]
